{
    "$schema": "./tariffs.schema.json",
    "earnie_data_model": 3,
    "oemag_monthly_feed_in_rates": [
        {
            "year": 2025,
            "month": 1,
            "tariff_cent_kwh": 9.73
        },
        {
            "year": 2025,
            "month": 2,
            "tariff_cent_kwh": 9.73
        },
        {
            "year": 2025,
            "month": 3,
            "tariff_cent_kwh": 6.007
        },
        {
            "year": 2025,
            "month": 4,
            "tariff_cent_kwh": 5.855
        },
        {
            "year": 2025,
            "month": 5,
            "tariff_cent_kwh": 5.855
        },
        {
            "year": 2025,
            "month": 6,
            "tariff_cent_kwh": 5.855
        },
        {
            "year": 2025,
            "month": 7,
            "tariff_cent_kwh": 5.965
        },
        {
            "year": 2025,
            "month": 8,
            "tariff_cent_kwh": 5.892
        },
        {
            "year": 2025,
            "month": 9,
            "tariff_cent_kwh": 5.892
        },
        {
            "year": 2025,
            "month": 10,
            "tariff_cent_kwh": 9.008
        },
        {
            "year": 2025,
            "month": 11,
            "tariff_cent_kwh": 9.167
        },
        {
            "year": 2025,
            "month": 12,
            "tariff_cent_kwh": 9.167
        },
        {
            "year": 2026,
            "month": 1,
            "tariff_cent_kwh": 8.842
        },
        {
            "year": 2026,
            "month": 2,
            "tariff_cent_kwh": 8.457
        },
        {
            "year": 2026,
            "month": 3,
            "tariff_cent_kwh": 5.72
        },
        {
            "year": 2026,
            "month": 4,
            "tariff_cent_kwh": 6.772
        },
        {
            "year": 2026,
            "month": 5,
            "tariff_cent_kwh": 6.772
        },
        {
            "year": 2026,
            "month": 6,
            "tariff_cent_kwh": 6.772
        }
    ],
    "monthly_float_reference_cent_kwh": 7.15,
    "import_tariffs": [
        {
            "id": "awattar_at",
            "label": "aWATTar Österreich (EPEX + Aufschlag)",
            "type": "spot_hourly",
            "land": "AT",
            "settlement_fee_cent_kwh": 1.5,
            "markup_percent": 3.0,
            "prices_include_vat": false,
            "vat_percent": 20.0,
            "supplier_id": "awattar_at"
        },
        {
            "id": "fixed_25ct",
            "label": "Fix 25 ct/kWh Bezug",
            "type": "fixed_cent",
            "fix_cent_kwh": 25.0,
            "supplier_id": "fix_25_ct_kwh_bezug"
        },
        {
            "id": "import_monthly_example",
            "label": "Monatliche Bezugspreise (Beispiel)",
            "type": "monthly_table",
            "monthly_rates": [
                {
                    "year": 2025,
                    "month": 1,
                    "tariff_cent_kwh": 22.0
                },
                {
                    "year": 2025,
                    "month": 6,
                    "tariff_cent_kwh": 18.0
                },
                {
                    "year": 2025,
                    "month": 12,
                    "tariff_cent_kwh": 24.0
                }
            ],
            "supplier_id": "monatliche_bezugspreise_beispiel"
        }
    ],
    "export_tariffs": [
        {
            "id": "fixed_37ct",
            "label": "Fix 3,7 ct/kWh Einspeise",
            "type": "fixed",
            "k_push_cent": 3.7,
            "supplier_id": "fix_3_7_ct_kwh_einspeise"
        },
        {
            "id": "dynamic_epex",
            "label": "Dynamisch EPEX (SUNNY Spot)",
            "type": "spot_hourly",
            "land": "AT",
            "settlement_fee_cent_kwh": 0.0,
            "feed_in_fee_factor": 0.19,
            "feed_in_fix_cent": 0.0,
            "monthly_fee_eur": 4.79,
            "prices_include_vat": true,
            "vat_percent": 0.0,
            "supplier_id": "awattar_at"
        },
        {
            "id": "monthly_sunny",
            "label": "aWATTar - SUNNY (Monatlich)",
            "type": "monthly_table",
            "monthly_rates": [
                {
                    "year": 2025,
                    "month": 1,
                    "tariff_cent_kwh": 9.73
                },
                {
                    "year": 2025,
                    "month": 6,
                    "tariff_cent_kwh": 5.86
                },
                {
                    "year": 2025,
                    "month": 12,
                    "tariff_cent_kwh": 8.7
                }
            ],
            "supplier_id": "awattar_at"
        }
    ],
    "econtrol_referenzmarktwert_pv_monthly": [
        {
            "year": 2025,
            "month": 7,
            "tariff_cent_kwh": 5.91
        },
        {
            "year": 2025,
            "month": 8,
            "tariff_cent_kwh": 3.21
        },
        {
            "year": 2025,
            "month": 9,
            "tariff_cent_kwh": 4.84
        },
        {
            "year": 2025,
            "month": 10,
            "tariff_cent_kwh": 8.85
        },
        {
            "year": 2025,
            "month": 11,
            "tariff_cent_kwh": 10.24
        },
        {
            "year": 2025,
            "month": 12,
            "tariff_cent_kwh": 11.26
        },
        {
            "year": 2026,
            "month": 1,
            "tariff_cent_kwh": 13.95
        },
        {
            "year": 2026,
            "month": 2,
            "tariff_cent_kwh": 8.16
        },
        {
            "year": 2026,
            "month": 3,
            "tariff_cent_kwh": 5.94
        },
        {
            "year": 2026,
            "month": 4,
            "tariff_cent_kwh": 1.7
        },
        {
            "year": 2026,
            "month": 5,
            "tariff_cent_kwh": 3.76
        },
        {
            "year": 2026,
            "month": 6,
            "tariff_cent_kwh": 5.55
        }
    ]
}
